[
    {
        "id":  "LAW001",
        "type":  "firm",
        "name":  "Cabinet Juridique Bruxelles SARL",
        "address":  "Avenue de la Toison d\u0027Or 45",
        "postal_code":  "1050",
        "region":  "Brussels",
        "phone":  "+32 2 512 3456",
        "email":  "contact@cabinetbruxelles.be",
        "website":  "https://www.cabinetbruxelles.be",
        "specialty":  [
                          "Commercial Law",
                          "Contract Law",
                          "Corporate Law"
                      ],
        "hours":  {
                      "monday_friday":  "09:00-18:00",
                      "saturday":  null,
                      "sunday":  null
                  },
        "languages":  [
                          "French",
                          "English",
                          "Dutch"
                      ],
        "fees":  {
                     "consultation":  150,
                     "initial_contact":  "Gratuit",
                     "payment_plans":  true
                 },
        "accessibility":  {
                              "wheelchair":  true,
                              "virtual_consultation":  true,
                              "phone_consultation":  true
                          },
        "reviews":  {
                        "rating":  4.7,
                        "count":  42,
                        "source":  "Google"
                    },
        "case_types":  [
                           "Business disputes",
                           "Contracts",
                           "Company formation"
                       ],
        "capacity":  "accepting_clients",
        "wait_time":  "1-2 weeks",
        "referral_contacts":  [
                                  {
                                      "name":  "Notaire Paul Dubois",
                                      "relationship":  "Professional network"
                                  }
                              ],
        "founding_date":  "2010",
        "staff":  12,
        "accreditation":  [
                              "Brussels Bar Association",
                              "ISO 9001"
                          ],
        "regions_served":  [
                               "Brussels",
                               "Wallonia"
                           ],
        "notes":  "Full-service firm specializing in corporate law",
        "source":  "Brussels Legal Directory"
    },
    {
        "id":  "LAW002",
        "type":  "individual",
        "name":  "Dr. Marie Dupont",
        "address":  "Rue de Namur 78",
        "postal_code":  "1000",
        "region":  "Brussels",
        "phone":  "+32 2 219 8765",
        "email":  "marie.dupont@avocats.be",
        "website":  null,
        "specialty":  [
                          "Family Law",
                          "Inheritance",
                          "Mediation"
                      ],
        "hours":  {
                      "monday_friday":  "10:00-17:00",
                      "saturday":  null,
                      "sunday":  null
                  },
        "languages":  [
                          "French",
                          "English"
                      ],
        "fees":  {
                     "consultation":  120,
                     "initial_contact":  "120 EUR",
                     "payment_plans":  true
                 },
        "accessibility":  {
                              "wheelchair":  true,
                              "virtual_consultation":  true,
                              "phone_consultation":  true
                          },
        "reviews":  {
                        "rating":  4.9,
                        "count":  58,
                        "source":  "Avocats.be"
                    },
        "case_types":  [
                           "Divorce",
                           "Child custody",
                           "Succession planning"
                       ],
        "capacity":  "limited_availability",
        "wait_time":  "3-4 weeks",
        "referral_contacts":  [
                                  {
                                      "name":  "Dr. Jean Moreau",
                                      "relationship":  "Colleague"
                                  }
                              ],
        "founding_date":  "2008",
        "staff":  1,
        "accreditation":  [
                              "Brussels Bar Association"
                          ],
        "regions_served":  [
                               "Brussels"
                           ],
        "notes":  "Specialized mediator, high client satisfaction",
        "source":  "Bar Association Referral"
    },
    {
        "id":  "LAW003",
        "type":  "firm",
        "name":  "Avocat.be - Brussels Office",
        "address":  "Boulevard Adolphe Max 22",
        "postal_code":  "1000",
        "region":  "Brussels",
        "phone":  "+32 2 547 3322",
        "email":  "brussels@avocat.be",
        "website":  "https://www.avocat.be",
        "specialty":  [
                          "Criminal Law",
                          "Administrative Law",
                          "Civil Litigation"
                      ],
        "hours":  {
                      "monday_friday":  "08:30-18:30",
                      "saturday":  "10:00-14:00",
                      "sunday":  null
                  },
        "languages":  [
                          "French",
                          "English",
                          "Dutch",
                          "German"
                      ],
        "fees":  {
                     "consultation":  180,
                     "initial_contact":  "Gratuit",
                     "payment_plans":  true
                 },
        "accessibility":  {
                              "wheelchair":  true,
                              "virtual_consultation":  true,
                              "phone_consultation":  true
                          },
        "reviews":  {
                        "rating":  4.5,
                        "count":  73,
                        "source":  "Google"
                    },
        "case_types":  [
                           "Criminal defense",
                           "Administrative appeals",
                           "Litigation"
                       ],
        "capacity":  "accepting_clients",
        "wait_time":  "1 week",
        "referral_contacts":  [
                                  {
                                      "name":  "Attorney General\u0027s Office",
                                      "relationship":  "Professional"
                                  }
                              ],
        "founding_date":  "2005",
        "staff":  25,
        "accreditation":  [
                              "Brussels Bar Association",
                              "Court Certified"
                          ],
        "regions_served":  [
                               "Brussels",
                               "Wallonia",
                               "Flanders"
                           ],
        "notes":  "24/7 emergency legal services available",
        "source":  "Professional Registry"
    },
    {
        "id":  "LAW004",
        "type":  "individual",
        "name":  "MichaÃ«l Verlaine",
        "address":  "Rue Royale 146",
        "postal_code":  "1210",
        "region":  "Brussels",
        "phone":  "+32 2 227 4567",
        "email":  "verlaine@avocats.be",
        "website":  "https://www.verlaine-avocat.be",
        "specialty":  [
                          "Real Estate Law",
                          "Property Conveyancing",
                          "Construction Law"
                      ],
        "hours":  {
                      "monday_friday":  "09:00-17:00",
                      "saturday":  null,
                      "sunday":  null
                  },
        "languages":  [
                          "French",
                          "English"
                      ],
        "fees":  {
                     "consultation":  140,
                     "initial_contact":  "140 EUR",
                     "payment_plans":  false
                 },
        "accessibility":  {
                              "wheelchair":  true,
                              "virtual_consultation":  false,
                              "phone_consultation":  true
                          },
        "reviews":  {
                        "rating":  4.6,
                        "count":  34,
                        "source":  "Avocats.be"
                    },
        "case_types":  [
                           "Property purchase",
                           "Construction disputes",
                           "Easements"
                       ],
        "capacity":  "accepting_clients",
        "wait_time":  "2 weeks",
        "referral_contacts":  [
                                  {
                                      "name":  "Real Estate Board Brussels",
                                      "relationship":  "Member"
                                  }
                              ],
        "founding_date":  "2012",
        "staff":  2,
        "accreditation":  [
                              "Brussels Bar Association"
                          ],
        "regions_served":  [
                               "Brussels"
                           ],
        "notes":  "Specializes in complex property transactions",
        "source":  "Real Estate Professional Network"
    },
    {
        "id":  "LAW005",
        "type":  "firm",
        "name":  "Legal Solutions Brussels",
        "address":  "Rue du Commerce 89",
        "postal_code":  "1000",
        "region":  "Brussels",
        "phone":  "+32 2 419 7743",
        "email":  "info@legalsolutions.be",
        "website":  "https://www.legalsolutions.be",
        "specialty":  [